[
  {
    "slug": "50a-marine-terrace",
    "name": "50A Marine Terrace",
    "type": "hawker",
    "lat": 1.30572974,
    "lng": 103.91573704,
    "address": "50A Marine Terrace",
    "stall_count_nea": 24,
    "stalls_documented": 0,
    "status": "open",
    "verified": "2026-09-14"
  },
  {
    "slug": "80-circuit-road-market-food-centre",
    "name": "80 Circuit Road Market & Food Centre",
    "type": "hawker",
    "lat": 1.32783415,
    "lng": 103.88710267,
    "address": "80 Circuit Road",
    "stall_count_nea": 16,
    "stalls_documented": 0,
    "status": "open",
    "verified": "2026-09-14"
  },
  {
    "slug": "85-fengshan-centre",
    "name": "85 Fengshan Centre",
    "type": "hawker",
    "lat": 1.33205998,
    "lng": 103.9388123,
    "address": "85 Bedok North St 4",
    "stall_count_nea": 72,
    "stalls_documented": 0,
    "status": "open",
    "verified": "2026-09-14"
  },
  {
    "slug": "abc-brickworks-market",
    "name": "ABC Brickworks Market",
    "type": "hawker",
    "lat": 1.28700995,
    "lng": 103.8081894,
    "address": "6 Jalan Bukit Merah",
    "stall_count_nea": 96,
    "stalls_documented": 0,
    "status": "open",
    "verified": "2026-09-14"
  },
  {
    "slug": "adam-road-food-centre",
    "name": "Adam Road Food Centre",
    "type": "hawker",
    "lat": 1.32415985,
    "lng": 103.81416592,
    "address": "2 Adam Road",
    "stall_count_nea": 32,
    "stalls_documented": 0,
    "status": "open",
    "verified": "2026-09-14"
  },
  {
    "slug": "albert-centre",
    "name": "Albert Centre",
    "type": "hawker",
    "lat": 1.30110202,
    "lng": 103.85411578,
    "address": "270 Queen Street",
    "stall_count_nea": 86,
    "stalls_documented": 0,
    "status": "open",
    "verified": "2026-09-14"
  },
  {
    "slug": "alexandra-village-food-centre",
    "name": "Alexandra Village Food Centre",
    "type": "hawker",
    "lat": 1.28630594,
    "lng": 103.80449264,
    "address": "120 Bukit Merah Lane 1",
    "stall_count_nea": 88,
    "stalls_documented": 0,
    "status": "open",
    "verified": "2026-09-14"
  },
  {
    "slug": "amoy-street-food-centre",
    "name": "Amoy Street Food Centre",
    "type": "hawker",
    "lat": 1.27923121,
    "lng": 103.84661927,
    "address": "7 Maxwell Road",
    "stall_count_nea": 134,
    "stalls_documented": 0,
    "status": "open",
    "verified": "2026-09-14"
  },
  {
    "slug": "anchorvale-village-hawker-centre",
    "name": "Anchorvale Village Hawker Centre",
    "type": "hawker",
    "lat": 1.39679315,
    "lng": 103.88843734,
    "address": "339 Anchorvale Road",
    "stall_count_nea": 36,
    "stalls_documented": 0,
    "status": "open",
    "verified": "2026-09-14"
  },
  {
    "slug": "ang-mo-kio-628-market",
    "name": "Ang Mo Kio 628 Market",
    "type": "hawker",
    "lat": 1.38098762,
    "lng": 103.84062809,
    "address": "628 Ang Mo Kio Ave 4",
    "stall_count_nea": 52,
    "stalls_documented": 0,
    "status": "open",
    "verified": "2026-09-14"
  },
  {
    "slug": "ayer-rajah-food-centre",
    "name": "Ayer Rajah Food Centre",
    "type": "hawker",
    "lat": 1.31186998,
    "lng": 103.7598038,
    "address": "503 West Coast Drive",
    "stall_count_nea": 80,
    "stalls_documented": 0,
    "status": "open",
    "verified": "2026-09-14"
  },
  {
    "slug": "ayer-rajah-market",
    "name": "Ayer Rajah Market",
    "type": "hawker",
    "lat": 1.31195998,
    "lng": 103.7591019,
    "address": "502 West Coast Drive",
    "stall_count_nea": 0,
    "stalls_documented": 0,
    "status": "open",
    "verified": "2026-09-14"
  },
  {
    "slug": "bedok-food-centre",
    "name": "Bedok Food Centre",
    "type": "hawker",
    "lat": 1.32035303,
    "lng": 103.9554749,
    "address": "1 Bedok Road",
    "stall_count_nea": 32,
    "stalls_documented": 0,
    "status": "open",
    "verified": "2026-09-14"
  },
  {
    "slug": "bedok-interchange-hawker-centre",
    "name": "Bedok Interchange Hawker Centre",
    "type": "hawker",
    "lat": 1.324629,
    "lng": 103.930477,
    "address": "208B New Upper Changi Rd",
    "stall_count_nea": 70,
    "stalls_documented": 0,
    "status": "open",
    "verified": "2026-09-14"
  },
  {
    "slug": "bedok-north-st-1-blk-216",
    "name": "Bedok North St 1 Blk 216",
    "type": "hawker",
    "lat": 1.32711995,
    "lng": 103.9332962,
    "address": "216 Bedok North St 1",
    "stall_count_nea": 82,
    "stalls_documented": 0,
    "status": "open",
    "verified": "2026-09-14"
  },
  {
    "slug": "bedok-north-st-3-blk-538",
    "name": "Bedok North St 3 Blk 538",
    "type": "hawker",
    "lat": 1.33210003,
    "lng": 103.9247208,
    "address": "538 Bedok North St 3",
    "stall_count_nea": 42,
    "stalls_documented": 0,
    "status": "open",
    "verified": "2026-09-14"
  },
  {
    "slug": "bedok-reservoir-blk-630",
    "name": "Bedok Reservoir Blk 630",
    "type": "hawker",
    "lat": 1.33298004,
    "lng": 103.9142075,
    "address": "630 Bedok Reservoir Rd",
    "stall_count_nea": 36,
    "stalls_documented": 0,
    "status": "open",
    "verified": "2026-09-14"
  },
  {
    "slug": "bedok-south-blk-16",
    "name": "Bedok South Blk 16",
    "type": "hawker",
    "lat": 1.32055998,
    "lng": 103.9355469,
    "address": "16 Bedok South Road",
    "stall_count_nea": 64,
    "stalls_documented": 0,
    "status": "open",
    "verified": "2026-09-14"
  },
  {
    "slug": "bendemeer-market-food-centre",
    "name": "Bendemeer Market & Food Centre",
    "type": "hawker",
    "lat": 1.31921668,
    "lng": 103.86302092,
    "address": "29 Bendemeer Road",
    "stall_count_nea": 88,
    "stalls_documented": 0,
    "status": "open",
    "verified": "2026-09-14"
  },
  {
    "slug": "beo-crescent-market",
    "name": "Beo Crescent Market",
    "type": "hawker",
    "lat": 1.28883089,
    "lng": 103.82735389,
    "address": "38A Beo Crescent",
    "stall_count_nea": 32,
    "stalls_documented": 0,
    "status": "open",
    "verified": "2026-09-14"
  },
  {
    "slug": "berseh-food-centre",
    "name": "Berseh Food Centre",
    "type": "hawker",
    "lat": 1.30734411,
    "lng": 103.85688878,
    "address": "166 Jalan Besar",
    "stall_count_nea": 66,
    "stalls_documented": 0,
    "status": "open",
    "verified": "2026-09-14"
  },
  {
    "slug": "blk-117-aljunied-market-food-centre",
    "name": "Blk 117 Aljunied Market & Food Centre",
    "type": "hawker",
    "lat": 1.32064637,
    "lng": 103.88702414,
    "address": "117 Aljunied Ave 2",
    "stall_count_nea": 79,
    "stalls_documented": 0,
    "status": "open",
    "verified": "2026-09-14"
  },
  {
    "slug": "blk-17-upper-boon-keng",
    "name": "Blk 17 Upper Boon Keng",
    "type": "hawker",
    "lat": 1.31508994,
    "lng": 103.8716812,
    "address": "17 Upper Boon Keng Rd",
    "stall_count_nea": 84,
    "stalls_documented": 0,
    "status": "open",
    "verified": "2026-09-14"
  },
  {
    "slug": "blk-724-ang-mo-kio-market",
    "name": "Blk 724 Ang Mo Kio Market",
    "type": "hawker",
    "lat": 1.37204003,
    "lng": 103.8464966,
    "address": "724 Ang Mo Kio Ave 6",
    "stall_count_nea": 45,
    "stalls_documented": 0,
    "status": "open",
    "verified": "2026-09-14"
  },
  {
    "slug": "boon-lay-place-market-food-village",
    "name": "Boon Lay Place Market & Food Village",
    "type": "hawker",
    "lat": 1.34528005,
    "lng": 103.7128525,
    "address": "221A/B Boon Lay Place",
    "stall_count_nea": 72,
    "stalls_documented": 0,
    "status": "open",
    "verified": "2026-09-14"
  },
  {
    "slug": "buangkok-hawker-centre",
    "name": "Buangkok Hawker Centre",
    "type": "hawker",
    "lat": 1.38298163,
    "lng": 103.89272101,
    "address": "70 Compassvale Bow",
    "stall_count_nea": 38,
    "stalls_documented": 0,
    "status": "open",
    "verified": "2026-09-14"
  },
  {
    "slug": "bukit-batok-west-hawker-centre",
    "name": "Bukit Batok West Hawker Centre",
    "type": "hawker",
    "lat": 1.35544583,
    "lng": 103.74207854,
    "address": "469A Bukit Batok West Avenue 9",
    "stall_count_nea": 22,
    "stalls_documented": 0,
    "status": "open",
    "verified": "2026-09-14"
  },
  {
    "slug": "bukit-canberra-hawker-centre",
    "name": "Bukit Canberra Hawker Centre",
    "type": "hawker",
    "lat": 1.44826336,
    "lng": 103.82276363,
    "address": "21 Canberra Link",
    "stall_count_nea": 44,
    "stalls_documented": 0,
    "status": "open",
    "verified": "2026-09-14"
  },
  {
    "slug": "bukit-merah-central-food-centre",
    "name": "Bukit Merah Central Food Centre",
    "type": "hawker",
    "lat": 1.28374004,
    "lng": 103.8171082,
    "address": "163 Bukit Merah Central",
    "stall_count_nea": 57,
    "stalls_documented": 0,
    "status": "open",
    "verified": "2026-09-14"
  },
  {
    "slug": "bukit-merah-view-blk-115",
    "name": "Bukit Merah View Blk 115",
    "type": "hawker",
    "lat": 1.28524005,
    "lng": 103.8223724,
    "address": "115 Bukit Merah View",
    "stall_count_nea": 84,
    "stalls_documented": 0,
    "status": "open",
    "verified": "2026-09-14"
  },
  {
    "slug": "bukit-panjang-hawker-centre-market",
    "name": "Bukit Panjang Hawker Centre & Market",
    "type": "hawker",
    "lat": 1.378269,
    "lng": 103.772432,
    "address": "2 Bukit Panjang Ring Rd",
    "stall_count_nea": 28,
    "stalls_documented": 0,
    "status": "open",
    "verified": "2026-09-14"
  },
  {
    "slug": "bukit-timah-interim-hawker-centre",
    "name": "Bukit Timah Interim Hawker Centre",
    "type": "hawker",
    "lat": 1.34078792,
    "lng": 103.77521471,
    "address": "2A Jalan Seh Chuan",
    "stall_count_nea": 78,
    "stalls_documented": 0,
    "status": "open",
    "verified": "2026-09-14"
  },
  {
    "slug": "bukit-timah-market",
    "name": "Bukit Timah Market",
    "type": "hawker",
    "lat": 1.33964503,
    "lng": 103.7758026,
    "address": "51 Upper Bukit Timah Rd",
    "stall_count_nea": 84,
    "stalls_documented": 0,
    "status": "under_construction",